ix,token,condition,initial_input,bot,rule_like,consistent,rule_type,categorization,edge,shade,Note
135,HVGIUUV4,A4,"whenever an active stone of any shape touches an inactive square it turns into a pentagon, the color of the pentagon depends on the color of the active stone, the pentagon formed becomes a darker color than the active stone",0,1,1,vague,A,constant,general,
139,LDW57CTI,A4,"When an active stone comes into contact with an inactive stone, the inactive stone is altered to a shape with one more side than it had previously.",0,1,1,vague,,R,unstated,
140,G7UTHKOM,A4,"all the case , the inactive stones ,have a shades of color, and it shape merged to the active stone ,it gives a pentagon, my guess is , the shape depends on the inactive stone shape .",0,1,1,vague,,constant,unstated,
142,220QN7QL,A4,The inactive shape is always changed to a pentagon & its shade is changed to one step darker than the active stone.,0,1,1,true_constant,,,,
143,KHYYARPE,A4,Square turns to pentagon and it maintains its color deepeness.,0,1,1,partial,,,,
144,3HP6O6E7,A4,when the active stone comes in contact with the inactive stone it changes it form/shape and sometimes the color. ,0,1,1,vague,,general,general,
145,YVJCGWFX,A4,"When the active stone hits the inactive stone, the inactive stone turns into a pentagon",0,1,1,vague,,constant,unstated,
151,FHHDVEUF,A4,"triangular , square , pentagon , hexagon",1,,,,,,,
152,GZIZJDYB,A4,"While an active stone hits an inactive stone, then the inactive stone's shape changed such as the number of sides increased such as square become pentagon. Also color of inactive stone also chnged to the next darker color.",0,1,1,true_relative,,,,
153,9MAWUCBZ,A4,"When active stones hits the inactive stones, the inactive stones shapes upgraded to one level( for eg if an active stone hits square shaped inactive stone it turns to pentagon shaped inactive stone).",0,1,1,vague,,R,unstated,
154,1514IVC4,A4,"the stones go into an active state in which they glow with a strange light . When an active stone is tapped against an inactive stone, it causes the properties of the inactive stone to change.",0,1,1,vague,,general,general,
157,0KUOB7G3,A4,nice,1,,,,,,,
158,NF7MIFS3,A4,"When the active stone hit the inactive stone, It changes in shape and color but remains as Inactive",0,1,1,vague,,general,general,
160,9N0BFS5U,A4,"If the active stone is darker than the inactive stone, it turns the inactive stone darker. The shape outcome always is the 5 sided shape when the original inactive stone is a square, no matter what shape the original inactive stone was.",0,1,1,vague,A,constant,general,
166,TXJNIW7G,A4,The active stone always turns the other stone into a pentagon.  The color depends on the active stone's color.  The darker the active stone the darker the inactive one becomes as well.,0,1,1,vague,A,constant,general,
176,7CPU57P2,A4,greatt,1,,,,,,,
178,SWDMELFX,A4,these mysterious gems are fast acting in a straight line,0,0,,,,,,
182,G8WYARU4,A4,They will increase by 1 side every time they are hit by a active stone,0,1,1,vague,,R,unstated,
183,KU14VEBS,A4,pentagan will change as the square. and if the active square is there it will be changed to pentagon ,0,1,1,partial,,,,
187,DSEXDTD6,A4,have improved and observed the she shapes ,0,0,,,,,,
190,JIE9BMZJ,A4,"Active stones cause cubes to turn into pentagons of a darker color, imparting their slanted edges to the cube.",0,1,1,partial,,,,
194,NUQ6N6ZH,A4,These mysterious stone change the color or shape of the inactive stone. ,0,1,1,vague,,general,general,
196,4TA0PDUR,A4," Atop a desolate hill in a small US town are the Georgia Guidestones: an ... his way to see the Coral Castle – another mysterious stone structure – in Homestead, Florida. ... of anonymous Americans foreign to Georgia who had been working",1,,,,,,,
197,5NFEGZ1Z,A4,the active stone move close to the inactive stone,0,0,,,,,,
202,0OVVLPSO,A4,An inactive stone when hit by an active stone changes in shape. In the case of a of an inactive square stone when hit by an active stone becomes a pentagon,0,1,1,vague,,constant,unstated,
207,J2HZ8WZO,A4,"When the active stone hits on the inactive one, the inactive square shape of the stone become pentagonal. If the color of the active stone is light, the inactive stone becomes/remains medium. If the active stone is medium color, the inactive stone becomes dark. If the active stone is dark in color,  the inactive stone becomes very dark. ",0,1,1,true_constant,A,,,
208,Y070HTOH,A4,There are two types of stones active stones and inactive stones.active stone reach the inactive stone then change pentagon position. most of the stone go to active state. it causes the properties of the inactive stones to change.,0,1,0,incompatible,,,,